start_time, end_time, country, region, city, street
1992-04-17, 2012-08-13, Spain, Andalucia, Sevilla, Santa Cruz                      
2014-08-13, 2014-12-17, Spain, Toledo, Madrid, Cortes                      
2014-12-17, 2016-08-10, Spain, Toledo, Madrid, zofio               
2016-08-10, 2016-12-20, USA, California, Los Angeles, Hollywood             
2016-12-20, 2018-06-03, Spain, Toledo, Madrid, zofio                             
2018-06-03, 2018-08-10, USA, California, San Francisco, Mission Bay                                                 
2018-08-10, present, Germany, Berlin, Berlin, Kreuzberg    